{
  "id": "auto-bb0f57f979a3",
  "title": "EuroEval",
  "url": "https://euroeval.com/",
  "type": "benchmark",
  "tags": [
    "benchmark",
    "llm-benchmark",
    "llm"
  ],
  "description": "EuroEval is a language model benchmarking framework that supports evaluating all types of language models out there: encoders, decoders, encoder-decoders, base models, and instruction tuned models.",
  "added_date": "2026-06-11",
  "added_by": "human",
  "language": "en",
  "access": "free",
  "archived": false,
  "year": 2025,
  "institution": "EuroEval"
}