{
  "id": "auto-170de07b6f31",
  "title": "Vizuara Researchers Achieve Multiple Paper Acceptances at NeurIPS, ICCV, and EMNLP Workshops | Sreedath Panat posted on the topic | LinkedIn",
  "url": "https://www.linkedin.com/posts/sreedath-panat_6-papers-accepted-across-neurips-iccv-and-activity-7376554466747191296-2o9O",
  "type": "paper",
  "tags": [
    "nlp",
    "research",
    "paper"
  ],
  "description": "6 Papers Accepted Across NeurIPS, ICCV, and EMNLP Workshops 2025\n\nWe are delighted to share that the Research Wing at Vizuara has achieved another milestone with multiple workshop paper acceptances this year.\n\nAccepted papers & workshops\n\nEARS-UDE: Evaluating Auditory Response in Sensory Overload with Universal Differential Equations\n👨‍💻 Authors: Miheer Salunke, PRATHAMESH JOSHI, Dr. Raj Abhijit Dandekar, Dr. Rajat Dandekar, Dr. Sreedath Panat\n📍 Workshop: AI for Science: The Reach and Limits of AI for Scientific Discovery (NeurIPS 2025)\n\nPhysics-Informed Learning Near Critical Transitions: A Comparative Study of UDEs and Neural ODEs\n👨‍💻 Authors: Urvi Bora, PRATHAMESH JOSHI, Dr. Raj Abhijit Dandekar, Dr. Rajat Dandekar, Dr. Sreedath Panat\n📍 Workshop: AI for Science: The Reach and Limits of ",
  "added_date": "2026-06-04",
  "added_by": "agent",
  "language": "en",
  "access": "unknown",
  "archived": false,
  "year": 2026,
  "quality_score": 7.0
}