{
  "id": "auto-f4223c62b9f9",
  "title": "10+ Free AI tools for 2026 | Google Cloud",
  "url": "https://cloud.google.com/use-cases/free-ai-tools",
  "type": "video",
  "tags": [
    "generative-ai",
    "research",
    "video"
  ],
  "description": "# 10+ Free AI tools for 2026 | Google Cloud\n\nPage Contents\n\n   Image 1Free generative AI training\n\nTry Gemini 3,our best model for reasoning, coding, and multimodal understanding in Google AI Studio\n\n# Free AI tools from Google Cloud\n\n## Work with the latest AI models and turn your ideas into apps with free AI tools\n\nGoogle AI Studio is the fast path for developers, students, and researchers who want to try Gemini models and start building with the Gemini Developer API. We also offer free tools for common AI use cases, including translation, image and video analysis, speech-to-text, and more.",
  "added_date": "2026-06-04",
  "added_by": "agent",
  "language": "en",
  "access": "unknown",
  "archived": false,
  "year": 2026,
  "quality_score": 6.0
}