{
  "id": "auto-d1cafa541508",
  "title": "Overview - Apple Machine Learning Research",
  "url": "https://machinelearning.apple.com",
  "type": "paper",
  "tags": [
    "machine-learning",
    "nlp",
    "computer-vision",
    "research",
    "paper"
  ],
  "description": "AuthorsMinsoo Kim, Arnav Kundu, Han-Byul Kim, Richa Dixit, Minsik Cho\n\nRead paper\n\n### Compute-Optimal Quantization-Aware Training\n\nresearch area Methods and Algorithms, research area Speech and Natural Language Processingconference ICLRPublished year 2025\n\nAuthorsAleksandr Dremov\\\\†, David Grangier, Angelos Katharopoulos, Awni Hannun\n\nRead paper\n\nExplore all publications\n\n## Events\n\nView all events\n\nIEEE/CVF Conference on Computer Vision and Pattern Recognition (CVPR) 2026\n\nMay 28, 2026research area Computer Vision\n\nApple is presenting new research at the annual IEEE/CVF Conference on Computer Vision and Pattern Recognition (CVPR), which takes place in person in Denver at the Colorado Convention Center from June 3 to June 7.",
  "added_date": "2026-06-04",
  "added_by": "agent",
  "language": "en",
  "access": "unknown",
  "archived": false,
  "year": 2026,
  "quality_score": 7.0
}