{
  "id": "auto-02787246c880",
  "title": "The Illusion of Thinking: Understanding the Strengths and Limitations of Reasoning Models via the Lens of Problem Complexity",
  "url": "https://machinelearning.apple.com/research/illusion-of-thinking",
  "type": "paper",
  "tags": [
    "machine-learning",
    "nlp",
    "research",
    "paper"
  ],
  "description": "# The Illusion of Thinking: Understanding the Strengths and Limitations of Reasoning Models via the Lens of Problem Complexity - Apple Machine Learning Research\n\n- [x] \n\nMachine Learning Research\n\nOpen MenuClose Menu\n\n   Overview\n   Research Highlights\n   Publications\n   Events\n   Work with us\n\nresearch area Speech and Natural Language Processingconference NeurIPS\n\ncontent type paperpublished June 2025\n\n# The Illusion of Thinking: Understanding the Strengths and Limitations of Reasoning Models via the Lens of Problem Complexity\n\nAuthors Parshin Shojaee†, Iman Mirzadeh, Keivan Alizadeh, Maxwell Horton, Samy Bengio, Mehrdad Farajtabar\n\nView publication\n\nCopy Bibtex [...] Equal contribution\n   † Work done while at Apple\n\nImage 1: Diagram illustrating a system that verifies both final answers ",
  "added_date": "2026-06-04",
  "added_by": "agent",
  "language": "en",
  "access": "unknown",
  "archived": false,
  "year": 2026,
  "quality_score": 7.0
}