{
  "id": "auto-f822f43a70d1",
  "title": "Best Open Source AI Models - IBM",
  "url": "https://www.ibm.com/think/insights/open-source-ai-tools",
  "type": "framework",
  "tags": [
    "generative-ai",
    "pytorch",
    "tensorflow",
    "open-source",
    "framework"
  ],
  "description": "The surging popularity of open-source AI tools, from frameworks like TensorFlow, Apache, and PyTorch; to community platforms like Hugging Face, reflects a growing recognition that open-source collaboration is the future of AI development. Participation in these communities and collaboration on the tools helps organizations get access to the best tools and talent.\n\n## The future of open-source AI\n\nOpen-source AI reimagines how enterprise organizations scale and transform. As the technology’s influence extends across industries, inspiring widespread adoption and a deeper application of AI capabilities, here’s what organizations can look forward to as open-source AI continues to drive innovation. [...] The diversity and accessibility of open-source AI allow for a broad set of beneficial use c",
  "added_date": "2026-06-04",
  "added_by": "agent",
  "language": "en",
  "access": "unknown",
  "archived": false,
  "authors": [
    "Tim   Mucci"
  ],
  "year": 2026,
  "quality_score": 7.0
}