{
  "id": "auto-dba1146c718a",
  "title": "Sciwand",
  "url": "https://sciwand.com",
  "type": "tool",
  "tags": [
    "document-analysis",
    "academic-search",
    "zotero-integration",
    "literature-analysis"
  ],
  "description": "A SuperAI overlay for your research knowledge base. Connects to Zotero, EndNote, Mendeley, and Bookends (reference managers), with a built-in PDF viewer and integrated AI features.",
  "added_date": "2026-07-29",
  "added_by": "human",
  "language": "en",
  "access": "paid",
  "archived": false
}