{
  "id": "auto-cc1964bcc5de",
  "title": "Best AI tools for academic research in 2026 - Lumivero",
  "url": "https://lumivero.com/resources/blog/ai-tools-for-academic-research",
  "type": "tool",
  "tags": [
    "research",
    "tool"
  ],
  "description": "For instance, general AI systems often lack transparency in how they generate outputs, can misinterpret context and nuance, and do not inherently reflect the methodological rigor required in qualitative inquiry, meaning researchers must critically vet and interpret all AI-generated suggestions rather than treat them as definitive insights.\n\nAs new platforms appear each year, researchers face a wide range of options with different strengths and limitations. This article outlines how AI-powered research tools support academic work, where common challenges arise, and how integrated research solutions such as NVivo, ATLAS.ti, and Citavi can help researchers maintain accuracy, consistency, and rigor across their projects. [...] Lumivero's tools integrate AI features into established research wo",
  "added_date": "2026-06-04",
  "added_by": "agent",
  "language": "en",
  "access": "unknown",
  "archived": false,
  "authors": [
    "Sam Guertler"
  ],
  "year": 2026,
  "quality_score": 6.0
}