{
  "id": "auto-3fee8ba3bf16",
  "title": "Guides: Artificial Intelligence (Generative) Resources: AI Tools for Research",
  "url": "https://guides.library.georgetown.edu/ai/tools",
  "type": "paper",
  "tags": [
    "generative-ai",
    "llm",
    "research",
    "tutorial",
    "paper"
  ],
  "description": "| Elicit | Elicit uses LLMs to find papers relevant to your topic by searching through papers and citations and extracting and synthesizing key information. | Semantic Scholar database | Free with paid subscriptions available. | Elicit FAQs |\n| Keenious | Keenious is a recommendation tool for academic articles and topics based on papers you upload. | Open Alex | Free with paid subscriptions available. | Keenious Help File |\n| Research Rabbit | Research Rabbit is a citation-based mapping tool that focuses on the relationships between research works. It uses visualizations to help researchers find similar papers and other researchers in their field. | Open Alex, Semantic Scholar, and other databases | Research Rabbit is currently free. | Research Rabbit FAQs | [...] | ChatGPT | While the AI ",
  "added_date": "2026-06-04",
  "added_by": "agent",
  "language": "en",
  "access": "unknown",
  "archived": false,
  "year": 2026,
  "quality_score": 6.5
}