{
  "id": "auto-0e49c692c532",
  "title": "Best AI Tools for Academic Research in 2026: A Step-by-Step Workflow Guide",
  "url": "https://www.thesify.ai/blog/best-ai-tools-academic-research",
  "type": "paper",
  "tags": [
    "research",
    "tutorial",
    "paper"
  ],
  "description": "Litmaps is the strongest option for researchers who need to visualize exactly how a highly specific set of papers interact with one another over a timeline.\n Connected Papers is the best AI tool for literature review overviews. If you find a single excellent paper and want to know \"what else looks exactly like this?\" without building a complex library, this tool provides an instant snapshot of the field.\n ResearchRabbit is ideal for ongoing, long-term discovery. By adding a few papers to a collection, the AI continuously works in the background to recommend new publications, making it an excellent tool for mapping the academic conversation. [...] Here is the core discovery stack:\n\n Consensus: best for quick evidence-backed answers\n Elicit: best for finding and comparing papers\n Semantic Sc",
  "added_date": "2026-06-04",
  "added_by": "agent",
  "language": "en",
  "access": "unknown",
  "archived": false,
  "year": 2026,
  "quality_score": 7.0
}