{
  "id": "auto-f8dcc89e2ecb",
  "title": "LLM for Zotero",
  "url": "https://yilewang.github.io/llm-for-zotero/",
  "type": "tool",
  "tags": [
    "zotero-integration",
    "literature-search",
    "literature-review"
  ],
  "description": "llm-for-zotero brings Large Language Models into the Zotero reader, so you can ask questions, summarize papers, inspect figures, compare sources, and save notes without leaving your library. It works with standard API providers, local OpenAI-compatible models, WebChat, Codex App Server, and Claude Code.",
  "added_date": "2026-07-29",
  "added_by": "human",
  "language": "en",
  "access": "free",
  "archived": false
}